{
  "anchor_provider": "local-file",
  "anchor_reference": "file:anchor-public-key.txt",
  "anchor_signature": {
    "algorithm": "ed25519",
    "key_id": "reproduce-anchor",
    "value": "nrxqQc2Vkxo36-N1qzBN_sYMk8F9XNkIf5kHOhdYoDcQLmxf0o2ERjiiCbQGiWwa4VcQ1XLrCD2g-4Gbb2XBBg"
  },
  "created_at": "2026-06-11T23:45:00Z",
  "kind": "proofrail.external-anchor.v0.5.2",
  "ledger_first_hash": "3d863d35f2e322c74e43a121da07d3bd0d3dd0230664d5702fa8224bcee829b0",
  "ledger_last_hash": "c97b67440f3939e9665d32352ae7fe4654d96f11485730796cbc0026490e84f0",
  "ledger_merkle_root": "aa754425ba0da8dc20a24361a58ca7b80624f9fc29ab600b605d91f5a79f83f0",
  "record_hash": "8bc8f947cbecab9fe6cdf17a187ea88391e956d7c0532a753af58fbf53af7be2",
  "sequence_range": {
    "end": 6,
    "entry_count": 6,
    "start": 1
  },
  "trust_checkpoint_hash": "a628e24977cd24e6554c75ea742b8f5e35991dc685e43b06b6765ef22845fc3d",
  "trust_checkpoint_present": true
}
